{
  "id": "990e8400-e29b-41d4-a716-446655440001",
  "session_id": "880e8400-e29b-41d4-a716-446655440000",
  "export_type": "curriculum",
  "source_id": "curriculum-plan-1",
  "config": {
    "template": "curriculum",
    "include_toc": true,
    "include_title_page": true
  },
  "status": "completed",
  "result_artifact_id": "aa0e8400-e29b-41d4-a716-446655440000",
  "created_at": "2024-01-15T09:00:00Z",
  "completed_at": "2024-01-15T09:10:00Z"
}
